TikTok Link,Transcript,Available
https://www.tiktok.com/@smookii_gamer/video/7535556656680275222,"It means tagging an ivory coast here because you can't be the
citizen with this beautiful nation from this beautiful country
from this beautiful ivory coast of African champions.
And then you can't bring anything to the change of your
country or to the development of your country.
It is very important so tag there here if you don't put an ivory chop there
while if it makes maybe france abidjan abidjan france uh uh uh uh ivory chop
ostrich spain germany flat because normally when we take a france like that
there we go abidjan normally the food there what he gives us is it's chocolate
it's true that you eat you eat chocolate until you become Asian it's true
that chocolate the pasta huh you don't we're not jealous but they have pasta
there spaghetti pasta uh how does it look like bread uh uh uh uh apricot uh
what do you call the food there and oh the other one there oh oh oh I forgot
the name anyway it's it's it looks like well yeah way uh beans stuff like
that stuff like that do they give us food?
So for us there no and ivory rib you have to put in
uh bread dog that's stuff that's it's bahouin.
While tourism even that is inside abroad even that is inside.
He already knows where he is going he already knows what he
is waiting for but it is not necessary pilot will eat bahouin
because if pilot has eaten bahouin has become heavy.
Don't give that to the pilots,
the pilots there you make them celebrate you.
Well get ready for food aside here's food
the pilots there except pilot hostess.
He must not eat the cavataux the alcohol the garba bah imagine if pilot ate garba
champion plane before going down to two hundred kilometers per hour on foot.
Hey because we have ten thousand to ten thousand kilometers on foot or we realize
airplane there is what no need pilot go eat garba to get on the plane there
no here is food of the pilots where they put it light to loco eh egg here is
pilot can eat that ah that at least it is addressed so airplane food in an
ivory coast where you put eh bread dog bawin seed sauce.
Well,
they're going to dirty the plane there anyway,
that's if the plane has to leave for corongo.
What did you cavato in?
That's it, that's it,
that's a good thing.
That's if the plane has to overcome maybe abidjan.
You had uh uh uh sea bass fish uh to loco but stuff like that stuff from home there
the stranger even who is inside the neighbor who is inside that is to say the guy
who is not from home who is inside he already knows where he is going he already
knows his destination he already knows what he is waiting for
That's how it is,
that is to say that it encourages people to come and visit the Ivory
Coast because since the same time,
the Minister of Tourism but then Mr.
sonou fofana but respect dad since he has the head the country is fine
people want the Minister even when you see him he gives you the desire
of himself to visit the Ivory Coast.
As long as you haven't visited you don't want to be quiet it's because they
live without visiting the ivory coast how you make alive without visiting
the ivory coast breathe even without visiting the ivory coast.
You hurt your body,
you hurt your body and this gesture when you see it gives you
the desire to visit the Ivory Coast.
Here it is and thanks to him today we have reached another level.
Frankly it's incredible.
What so my respects dad my respects for everything you still do for
the ivory coast and we say thank you again thank you once again here
is now an ivory coast here to you so it's very important like that
so put the dishes from home put the food from home.
There those who are already in in in in in in in in in in the airbus
they know where they are going they know what awaits them it is
very important but you will leave to give them pasta.
We are not Guinean uh beans all that is the
white thing les cabatos les placali.
Here is when we wake up in the morning not often the veil there is
a long time when we wake up in the morning when we wake up from sleep
when it gives cupboard the warm when it is hot if it has typed that
like that it will give him still want to come in an ivory coast or
that it is it is the ideas it is the it is the ideas.
I give you put this in place you will see you will come and thank me here.",yes
https://www.tiktok.com/@aidansimardone/video/7559803344810691847,"Your coast is a highly diverse country
with over 60 distinct ethnic groups.
Today I want to talk about the five largest
starting off with the Southern Mandate people.
Now the Southern Mandate, this is less of a distinct group
and more of a cluster of people who speak the same language
and includes groups such as the Dan and Goro people.
They make up roughly 8.5% of the population.
There's 2.5 million of them along with a large population in Liberia.
They're in the central western part of the country
and one of the groups as I mentioned,
the Goro people who are within the Mandae,
the Southern Mandae, they're known for the zauli dance
this dance has actually gone quite famous and I can see why
it's quite beautiful. For instance,
it's has gone international fame.
It's music videos
such as by the artist Mia in the recently released movie sinners
and is now actually recognized as part of the UNESCO Heritage site.
Now at number four,
we have the crew people they make up roughly 9% of the population.
There's 3 million of them and a further 200,000 in Liberia.
They're in the southwestern part of the country
and according to one colonial source,
which you know might not be the most reliable,
but according to one colonial source,
apparently there were some of the fiercest resistors to
enslavement and colonialism.
They actually used to put a tattoo on their head
to distinguish themselves as free people.
Now at No. 2 or 3 depending on how you want to split the tie
there is the Northern Monday people.
They are less of a distinct group as well.
They're a cluster of different groups.
One of the larger groups,
groups within them being at the Mandinka people.
They make up roughly 22% of the population.
There's 7 million of them
but oh my gosh, there's also so many in other countries.
There's for instance at for the 4 million in Guinea,
2 million Mali and another 1 million in Senegal
and they're in the Northwestern part of the country
and out as I mentioned, one of the Northern Mandae groups,
this is the Medina
they used to have a large empire which was called the Mali Empire,
went from the 1200s to the 1600s
and its leader
Mansa Musa is considered to be the richest person ever actually,
which I find quite fascinating,
apparently being worth almost $400 billion.
Next we have the Gor people and again this is a cluster of groups,
the largest being the Sanuafo people.
It makes up roughly 22% of the population.
There's seven million of them
and also a further one million in the country of Mali.
They're in the northeastern part of the country and as I mentioned
the Senufo
so they are actually known for their quite intricate sculptures.
These sculptures have gone famous and quite beautiful.
The only thing I do hope though
is that at least some of that money actually goes back to
The Senufo people, and it's not just hogged by Westerners,
for instance, and at number one we have the Akahn people.
They make up 38% of the population.
There's 11 million of them,
plus a further 14 million in Ghana
where they make up actually roughly half the population there.
They're in the southwestern part of the country
and they're known for the Shanti Kingdom,
which actually fiercely resisted the British,
as well as actually having quite a large influence on the Jamaican
language, Jamaican English, Patwa.
So there you go. If you're one,
what if you're part of one of these groups,
please let me know in the comments down below.
I would like to hear what you think and please share and like.
Thank you.",yes
https://www.tiktok.com/@sekouberete68/video/7504612192839372054,No transcript available,no
https://www.tiktok.com/@monsieur_freeman/video/7546373845582761272,"In the heart of Abidjan stands Tower F,
the highest tower in Africa.
Architectural jewel it symbolizes modernity,
innovation and dynamism of the Ivory Coast.
Alongside it,
the teenage bridge transforms traffic and rereads
the city with fluidity and elegance,
facilitating the daily lives of thousands of Ivorians.
Further on,
Cocodie Bay is emerging as a future iconic district combining luxury,
modernity and harmony with nature,
a true business and attraction cluster,
Tower F is not just a building,
it is a showcase of success,
a symbol of power on the African continent and an essential
landmark in the landscape of Abidjan.
All this is made possible by the vision and determination of President Alassane
Watara who is working for a future-oriented and great Ivory Coast.",yes
https://www.tiktok.com/@assouman.patricia/video/7485294656771706117,"I say they are not grateful they are not even grateful.
How to
forget?
We don't forget to step back
how much like this
I don't want to oh let's see.",yes
https://www.tiktok.com/@grce4532/video/7485506199517990149,"Uh chicken
long ago,
hey you.",yes
https://www.tiktok.com/@sokiskengne4777/video/7536543975944031494,"But what is there in Côte?
I don't understand the picture here look very
early this morning everyone is out.
What's up,
what's up in Ivory Coast.",yes
https://www.tiktok.com/@kremlin.media/video/7561301807310376214,"No more demonstrations in Ivory Coast
the country is now saved
Vladimir Putin has just seized the file of the Ivory Coast
Alexander Raman watara is screwed
Vladimir Putin in collaboration with the UN
have officially cancelled Alexandre Watara's 4th term
peace can now reign in Côte d'Ivoire
just take 1 second to subscribe and write no
in the 4th term in comments and I explain everything to you
Vladimir putin
President of Russia
in collaboration with the United Nations
has just made 1 decision
alassane Draman watara's 4th term has been officially cancelled
this decision
welcomed by 1 part of the Ivorian population
marks 1 major turning point in the political future of Côte d'Ivoire",yes
https://www.tiktok.com/@mano_tikaly_abidjan/video/7548053867062250808,No transcript available,no
https://www.tiktok.com/@featurehistory1/video/7539608133254106390,No transcript available,no
https://www.tiktok.com/@unepersonne_57/video/7549389589320846597,No transcript available,no
https://www.tiktok.com/@zoneinfluence/video/7510321934857440534,No transcript available,no