TikTok Link,Transcript,Available
https://www.tiktok.com/@chou.zi.chu.pdg.t/video/7562499042698202390,"Last minute information in Côte d'Ivoire
the elections have just been postponed
to add the name of Laurent Gbagbo to the electoral list
after several days of intense manipulation
Alassane Ouattara has just announced as a matter
of urgency the postponement of the elections
and intends to select the voters list
to the name of Laurent Gbagbo
this surprise decision totally upsets the Ivorian political landscape
Gbagbo supporters cry victory for the people
and welcome 1 long- act of justice
while on the side of power
some speak of a political
to calm the growing social tension
in several cities across the country
crowds are already gathering to celebrate this new
the return of Gbagbo's name to the voters' list
holds out hope for a more inclusive election
and a true national reconciliation
Côte d'Ivoire enters a decisive new political era",yes
https://www.tiktok.com/@rhdp_officiel/video/7561210671707245836,"dear compatriots
I am at the salouata
I have solutions for you
yes my program of
government will take care of all Ivorians
without exception
Ivory Coast wants peace
My ambition is that you can bring
your contribution
to the development of our nation
haha
our proposals were refused
the big brokers imposed their prices
what do we have for them
asked from the moment they themselves
set a price that does not compensate the farmer's work
I remember when I was the first minister
of President Félix Soufoi-boigny
his dream was to reach
the figure of 1000 francs of of cocoa
and dear dad we made it
so you can be proud of us
when you look in all the countries of the world
great nations have been built
first from the peasant world
and to get there
we must not leave the farmers aside
it is necessary to accompany them with courageous reforms
I will make sure that there is
1 new case for cotton and natale
and the reforms that we
have recently undertaken in the agricultural sector
in reality
have enabled our sector
of exit from its lethargy of endon
it has indeed allowed to boost the productions
but also and especially
to be able to give remunerative prices to our producers
whether it is in the major export channels
and we have seen it recently with the prices of coffee and cocoa
cocoa well dried and well shouted
1 set atdeux-mille-huit-cents francs per kilogram
it is in all sectors that in reality
prices have increased to the producer
and it allows them to have the income
and it especially gives the incentive to these producers to
continue to work in the agricultural sector
to continue to improve their performance
so that when finished
it is the Ivorian consumer who has the choice of
agricultural products that are put to their
market availability
and at 1 slightest stroke
we will go further in food sovereignty
and for the earth to stay 1 chance for all
young women and rural communities
we will build 1 more inclusive agriculture
and more resilient
my dears
this is our ambition
1 great Ivory Coast that dares
that innovates and produces
1 great nation that brings together reassures and protects
I invite you to go out number of Saturday 25/10
to vote in peace
vote backwards so that together
we were building
1 great country I thank you",yes
https://www.tiktok.com/@kadyjasminedoumbi/video/7561763277387074827,No transcript available,no
https://www.tiktok.com/@pays.du.monde12/video/7529956101681319190,"Country Côte d'Ivoire,
capital Yamousucro,
area,
trois-cent-vingt-deux-mille-quatre-cent-soixante-deux
square kilometers continent Africa,
Ivorian or Ivorian Gentile Largest city,
Abidjan boake yamusukro d'aloha San Pedro,
president Alassane watara independence 07/08 mille-neuf-cent-soixante Official
language French Motto the union makes the nation,
telephone code,
deux-cent-vingt-cinq population,
approximately inhabitants Richest person,
Jeanou Diagou,
most spoken language,
dioula CFA franc currency,
gross domestic product GDP,
approximately 70 billion US dollars.
Favorite food,
Athiéké foutou garba Popular personality,
Didier Drogba,
asalfo,
Muriel Aouré.
Natural resources,
cocoa, oil,
gold,
coffee,
rubber Famous place,
basil,
our lady of peace,
grand Bassam national park,
Abidjan pyramid,
Banco park.
If you like this type of content,
subscribe quickly.",yes
https://www.tiktok.com/@cote.divoire.demain/video/7562575404993711372,"the youth of Côte d'Ivoire is in the process of demonstrating
because our constitution is violated
the youth of Côte d'Ivoire is in the process of demonstrating
because our constitution is violated",yes
https://www.tiktok.com/@kaneibrahim0/video/7562504728907681080,No transcript available,no
https://www.tiktok.com/@cotedivoire220/video/7562318331294895363,"At the very moment in adjamy mosque,
look what is happening here now.",yes
https://www.tiktok.com/@nick.ton.pre6/video/7562242814927588630,"Today 17/10 deux-mille-vingt-cinq,
the march continues in Côte d'Ivoire.
We just learned that huge crazy people
are still out in the streets of Abidjan.
The people shout too much is too much and demand real change,
justice and freedom everywhere.
Only 1 voice rises,
the people have already chosen their president.
Share this video as much as possible
so that the whole world sees the truth of the Ivorian street.",yes
https://www.tiktok.com/@sans.tabous70/video/7560029806977617154,No transcript available,no
https://www.tiktok.com/@vitefaitbara01/video/7562575902249569558,"The news of the ins of this 18/10deux-mille-vingt-cinq,
The national television RTI makes the propaganda of Terreaux Terreaux,
Yes,
me quickly,
it does not fall to me that I see RTI make the propaganda of Terreaux Terreaux,
We saw Wassim Nas who tells us that the military
of alassandraman watra and then Terreaux Terreaux,
there they avoid each other,
Yes,
in the borders,
they avoid each other,
the military of Alassane Draman watera and then terrottero,
they avoid each other,
We saw hold Draman watera who left,
the son of alacendraman watra who left for Turkey,
Go tell the Minister of Defense sorry to stop selling arms in Burkina Faso.
But I'm not surprised today if people tell me no,
yes,
terroteros are housed,
hey, fed.
Financed by theial regime of Côte d'Ivoire.
I'm not surprised.
Today,
RTI is making propaganda ads for Terreaux Terreaux.
Let's follow this video all together and very carefully.
The top family,
We're gone,
News.
The group used the weapons of Malian forces to commit war crimes.
What does the report of the global
initiative against transnational organized crime say?
The Russian paramilitary group operated in
Mali from Decemberdeux-mille-vingt-et-un,
it was replaced last June by Africa copse.
Attached to the Russian Defense Ministry,
jitok researchers accuse anyone of hijacking their Malian
jitok partner's weapons also point to violations of arms trade law.",yes
https://www.tiktok.com/@maguineedabord_224/video/7562529375233608982,No transcript available,no
https://www.tiktok.com/@dlice085/video/7562527915578035478,"It's over for Alassane watara The UN has just decided,
Laurent Bagbo will be a candidate for the presidential elections
in Côte d'Ivoire It's official,
Laurent Bagbo is the favorite candidate and accepted by Ivorians If you agree,
subscribe to be always informed.
Ivorians are always present for gagbo in the streets
and cities The demonstrations will never stop.
The UN has all seen Alassane Watara's plans to fly.
1 new mandate It won't happen They failed whether bakbo will be the president of
Côte d'Ivoire Kalsan watara wants or doesn't want Vive la Côte d'Ivoire,
viva la Côte d'Ivoire Subscribe for more information
videos about Côte d'Ivoire.",yes
https://www.tiktok.com/@nick.tamer79/video/7562609193191116055,"The Ivorian people have suffered too much,
but today they stand up,
their hearts are beating for the truth,
for justice,
and this heart is beating with Fr.
P. A. C.
I.
By Laurent Bagbo Subscribe,
share Ivory Coast wakes up.",yes
https://www.tiktok.com/@mister.booba0/video/7514667677529459990,"But baby, we both know this is not our time.
No, I don't care about the money.
Cause I don't want to still be loved.
And all I care about is you, boo.
It's like I'm here. Like I'm the Superman.",yes
https://www.tiktok.com/@helloooolaulau/video/7545941718676327702,"Ah well,
that's it,
we agree,
soon if you have time.
We
is in this camp and we told him,
uh.",yes
https://www.tiktok.com/@ahhkader/video/7561558041049435403,No transcript available,no
https://www.tiktok.com/@manepoke/video/7535709787502284046,No transcript available,no
https://www.tiktok.com/@lemediapositif.afrique/video/7494356981004668182,"You there it seems you have neither eh translation
you are cheap you are stingy.
Welcome to the Ivory Coast.
Where your behavior can betray your ethnic group cuckoo is kawaii certified cultural
explorer and today we go in the stereotypes Medina with us annies we say that they
are stingy not to lend them your money eh otherwise you will cry dry.
But in real life it's mostly from their culture
of savings and financial prosperity.
They are just good strategists.
BT by people is killed the accent eh?
It is said that they like to talk too much,
especially for nothing,
but the truth is that their tradition is based on speech.
The baoulés that they like bluff.
Yeah always married to 1 European somewhere but it's just the open-mindedness
and their massive presence in the big cities that play.
Ah the didas we say 2 who are tricky calculating even 1 little wizard
for some but in real it is just bosses of the resourcefulness and the
yakubas we say they have big head way and you it is what?
The strongest ethnic grouping in your home?
Balance in comment but we respect each other here it is not palable.",yes
https://www.tiktok.com/@eagleeyeproduction1/video/7464335397905091856,No transcript available,no
https://www.tiktok.com/@fenixtv96/video/7560292083915820310,No transcript available,no
https://www.tiktok.com/@yelaoff/video/7562699683345386774,"balai would have been seen in Belgium.
I told you for a long time that she is not in Ivory Coast,
she can't stay in Ivory Coast and do that.
It has to be.
We catch it
because there is what is called triangulation,
there is the tracking of IPN addresses and metadata,
that is,
the videos she makes,
if she is in Côte d'Ivoire and had published,
despite the fact that it is hidden,
the video,
where she published it,
every video,
there are what we call traces.
In fact,
it allows.
As soon as the inspectors take the video,
they will analyze the video,
they will be able to find out where the video was produced,
where it was published.
So she can be geolocated,
it can only take longer,
but it can be found.
What she is doing here,
she is so confident to do so,
simply because it is no longer in Ivory Coast.
There is what is called metadata analysis and geolocation of media,
This is also called requisitioning from hosting platforms,
there is also called facial recognition and advanced video analysis.
If everything I just told you before doesn't work out,
there's this too.
There is also what is called social network surveillance
and real-time monitoring.
Are you playing with the state of Côte d'Ivoire?
We told you,
material level,
technical level,
eh, they are.
Very very advanced,
you know in Africa,
they have to see why.
Well,
you'll see too,
you will know that the Ivory Coast aims to be developed.
1 developed country takes example from other developed countries.
So in terms of technology,
this is the Ivory Coast,
it wants everything
and is currently very very advanced.
You who think you are hidden,
are not?
Hide that no,
she is in Ivory Coast,
she is hidden by Ivorians!
Mdr !
Anything!
Long live the Ivory Coast,
long live the president will vote!
Long live the rule of law!",yes
https://www.tiktok.com/@partisane.ivoirienne/video/7559868052746079490,"Share in everyone Share in everyone Share in everyone Share in everyone Share
in everyone Share in everyone Share in everyone Share in everyone Share in
everyone Share in everyone Share in everyone Share in everyone Share
Share all in
Share in everyone Share in everyone Share in everyone Share in everyone Share
in everyone Share in everyone Share in everyone Share in everyone Share in
everyone Share in everyone Share in everyone Share in everyone Share",yes
https://www.tiktok.com/@lesexplicationsdedevincy/video/7560030217310326072,"Here is what to remember this Saturday in Ivory Coast.
We start with the 1st news in
Abidjan,deux-cent-trente-sept arrest despite the prefectural ban,
1 march of the opposition tried to be held
this Saturday result in front of 1 huge crowd,
Lassan Watara promised the construction of a highway.
Yamsokro da Loa comes to booze.
He defends 1 infrastructure and electrification
assessment and promises to do even more for The Local Development
Autotrophy.
Some ivoryan in the mere condition,
The Lasanian V Peru is a functional
Kalilou Sila,
appointed head of the Department of
Economic Affairs and Agriculture at the CDAO,
an expert in regional integration,
he succeeds Massanger Touré and wants to
strengthen food security and regional trade.",yes
https://www.tiktok.com/@exprience.winner/video/7562532109055773963,No transcript available,no
https://www.tiktok.com/@awa.oumarou7/video/7507765723729546502,No transcript available,no
https://www.tiktok.com/@sooleeee0/video/7537039023194246456,No transcript available,no
https://www.tiktok.com/@luxor_best_immobilier/video/7561811895053782274,No transcript available,no
https://www.tiktok.com/@princeadams0251/video/7561227413967949078,"And now the Ivorians can come forward.
Here's Pepe driving into the area.
The pass into. Guess on just behind him.
The shot comes in and you just gonna just flex over the line.
No, it isn't.
Cleared off the line by the defender.
The ball still alive for the Ivorians. And then the chip shot
flies harmlessly wide.
First opportunity there for the elephants.
Pepe, who drove into the area.
The pass across just behind Gessel. Diallo
one on one, cuts inside.
Yala. Yala plays the ball across goal.
Lovely first touch there. And there's the opener.
And it's the captain, Frank Kessie.
Well, Amatiello making the run down the right,
cutting inside. Finding just the right pass there
as Kessie arrived at pace from midfield,
timing his run to perfection.
You can just see the run from Keshi.
And that first touch just takes him past the entire defensive line.
And the second touch slams it into the
nicely laid off opportunity here.
Oh, lovely first touch
and a brilliant save there from Modiambo.
More direct running this time from Kone.
Conner plays the 1 2.
Gael Deulofeu
going to ground there the halfway.
Diomande drops deep now. Drops a shoulder,
goes past one old jinks past another as well.
Diomande. Oh,
skips past the fourth player now as well.
Cuts inside.
Eventually the ball goes out for a corner.
Lovely change of pace there from Yan Zhao.
And wanders into the area as well.
Pepe curls it. In the header, just wide of the upright.
Evan Endecott
stealing in there,
the Roma centre back.
Now Gesso got Diallo on the right
outside in.
The flag stays down. Guess Diallo, though,
couldn't find the cross. That will be a.
Will it be a corner? No, it won't.
It's wonderful.
Diemond again putting on the after burners,
taking past two. Your side
flag stay down here. The keeper's out of position.
It's been slammed into the side netting by Nicholas Pepe.
That really should have been 2 nil.
بابا جی سیالکوٹ
lovely ball through after the run from d m O
and he had Amad Diallo waiting there unmarked in the cross
to deflect to the feet of Gesso
and now all of a sudden they're in behind again here Pepe
drives into the area
given away midfield again by the Haringey stars and now Pepe
finds a bit of space on this near side gets
away from the attempted foul
can't find the put the ball back gets the ball back
again second bite of the cherry for the number nineteen
lays it off to Diallo
Diallo goes to the top corner and that's just over the crossbar
the half the stadium thought that one was in.
As it caught the top of the net
Aquaro Klirs
do I chip it in towards guess on guess on lays it off
oh and again Kesia this time
skipping away from the challenge plays the ball into DMM on, DMM On now
crowded out, but there's a bit of a clip that coming in from Sissoko
and this freak
left footed might fancy that top left corner. But
Kone forced backwards. Oh,
lovely turn though by Kone.
Leaves his marker behind him.
Now Diomande uses his place,
goes past one, cuts inside Diomande.
Oh, fantastic goal from beyond Diomande.
And a goal that's richly deserved for the 18 year old.
Superb in the first half. And again as soon as he gets the ball in feet.
The Kenyan defence simply can't cope.
Picking up the ball here in the inside left position,
cutting past one and cutting inside
and just letting fly into the bottom corner. Beautiful finish.
Franck Yann Diemont now having started 4 days ago against Seychelles,
getting another start here.
Diemont
finds Conan running into space,
Conan trying to get in behind,
cuts the ball back and all. That was a
interesting attempt at the goal there from Evan. Get!
And the loose ball blazed over the bar.
I am at Diallo Cutting
now. Halle played in behind Halle
or is he taken down on the edge of the area?
Yes, as a referee.
Well, on the bright side for the former Dale.
And it is Diallo. Oh, great shot!
Questions may be about the keeper,
but I'm not. Diallo won't care.
A second international goal
for the Manchester United youngster.
And that surely is the cherry on top. Now for the elephants.",yes
https://www.tiktok.com/@cotedivoire220/video/7560135650117242134,No transcript available,no
https://www.tiktok.com/@shekina.225/video/7456071023742520598,"This dispatch that comes to our attention
of the Lebanese authorities who tell us tonight,
it's official,
deux-mille-sept-cent-cinquante tons of ammonium nitrates
are at the origin of the explosions in the port,
this is what they tell us
tonight.
At least that's the official message.",yes
https://www.tiktok.com/@fedely_fed/video/7561501687433694476,No transcript available,no
https://www.tiktok.com/@toutestpossible_tes/video/7534050207223352598,"Here are three populations you don't expect to see
in Côte d'Ivoire And when do you see them?
Say eh but what are they doing here There One Chinese listen carefully
to what I'm going to tell you the first time I saw a Chinese there,
well an Asian,
but I think it was a Chinese.
It was in deux-mille-vingt-deux And I didn't see it
in abidjan where everything happens,
eh I saw it on the road between abidjan and then drinking at the level of the brand
new hospital of abyss which was at the end of construction.
It seems to me at that time I swear,
it's true And usually that's why they go there
because they build our infrastructure,
our buildings,
our roads,
all that there And then they're in business too.
As evidenced by the china malls that like to check everywhere in a can there,
but they are good because their infrastructure,
like the china mode for example,
are quality.
There's nothing to say.
Two,
the Americans have a lot of them anyway.
Well,
it's obvious those who work in the,
but generally the Americans are there for diplomatic and humanitarian missions,
or even for business,
but not for food in the water.
What are the last ones?
It's a mixed because there aren't many,
the Spanish and the Indians Well the Spanish and the Indians,
there really aren't many,
but there are And to tell you the truth,
I looked,
I didn't find what they do exactly in ivory coast So
if there are any who watch this video,
tell me a little bit what your activities are there.
I would love to know if there are any populations you
don't expect to see there that I have forgotten.
Tell me which ones in comments.",yes
https://www.tiktok.com/@full.galsen/video/7561208554082880790,"Elephants are back as a couple from the FIFA world?
to the Ivory Coast.
and
has no advice,
eh,
only to him.
Go down to the end of the hammer,
go down to the end of the jersey.
End of the hammer,
it's end of the hammer,
do you do this?
Why?",yes
https://www.tiktok.com/@realjordanevraa/video/7561192865628441887,"Ha ha! when,
the ivory coast,
he could not see in,
world cup in the united states,
canada,
Mexico,
I'll see in it.
Ciao.
Now that we're qualified,
it's now.
We tell you your real names,
all of you,
when we tell you that we are African champions,
we decide to do what we want,
whenever you want.
We win whenever we want,
we suck when we want to.
Do you think it's a game?
the same things ?
10 games,
zero goals conceded,
it's the same thing.
Uh, seriously, flaw,
the number nine,
will you keep it for me,
please?
well,
the country being qualified,
let's talk a little business.
If you need airbnb,
of car to move you
when you are coming to the world cup,
let me know in dm,
ha ha!
it's not about you,
right,
but in the list of the best runners-up,
there,
I want Nigeria to qualify,
ha ha!
Cameroon,
is the danger theory.
It's when you think that.
Ah my son,
that's it,
ha ha, ha ha!
how are the malians?
Are you okay?
there is a tiny country that gets by
in disputes with other countries.
Have you seen your place?
you can only be 1st
at the 2nd.
That's where it is.
Ha ha!
That's what you deserve,
and yet,
you have a lot to do.
There is Cameroon,
There’s Kondo,
there’s Nigeria.
Hey ! Hey !
You won't be going to the World Cup,
I'm sorry Yamatos,
the heat,
the tap tap scene application.
Use my flex promo code
two hundred and twenty-five
to send money to Africa.
And then in my comments,
there,
your country is not yet qualified for the World Cup,
ha ha!",yes
https://www.tiktok.com/@mhd.say/video/7517434850643692806,"What do you want baby You want this baby You like it baby This
is for you baby You want what baby You want this baby.",yes
https://www.tiktok.com/@ins_dnc/video/7560036783052836107,No transcript available,no
